{
  "$schema": "https://json-schema.org/draft/2020-12/schema",
  "$id": "urn:effortless:buildfix.plan.v1",
  "title": "buildfix.plan.v1",
  "type": "object",
  "additionalProperties": false,
  "required": [
    "schema",
    "tool",
    "repo",
    "inputs",
    "policy",
    "preconditions",
    "ops",
    "summary"
  ],
  "properties": {
    "schema": {
      "const": "buildfix.plan.v1"
    },
    "tool": {
      "type": "object",
      "additionalProperties": false,
      "required": [
        "name",
        "version"
      ],
      "properties": {
        "name": {
          "const": "buildfix"
        },
        "version": {
          "type": "string"
        },
        "commit": {
          "type": "string"
        }
      }
    },
    "repo": {
      "type": "object",
      "additionalProperties": false,
      "required": [
        "root"
      ],
      "properties": {
        "root": {
          "type": "string"
        },
        "head_sha": {
          "type": "string"
        },
        "dirty": {
          "type": "boolean"
        }
      }
    },
    "inputs": {
      "type": "array",
      "items": {
        "type": "object",
        "additionalProperties": false,
        "required": [
          "path"
        ],
        "properties": {
          "path": {
            "type": "string"
          },
          "schema": {
            "type": "string"
          },
          "tool": {
            "type": "string"
          }
        }
      },
      "default": []
    },
    "policy": {
      "type": "object",
      "additionalProperties": false,
      "properties": {
        "allow": {
          "type": "array",
          "items": {
            "type": "string"
          },
          "default": []
        },
        "deny": {
          "type": "array",
          "items": {
            "type": "string"
          },
          "default": []
        },
        "allow_guarded": {
          "type": "boolean",
          "default": false
        },
        "allow_unsafe": {
          "type": "boolean",
          "default": false
        },
        "allow_dirty": {
          "type": "boolean",
          "default": false
        },
        "max_ops": {
          "type": "integer",
          "minimum": 0,
          "default": 50
        },
        "max_files": {
          "type": "integer",
          "minimum": 0,
          "default": 25
        },
        "max_patch_bytes": {
          "type": "integer",
          "minimum": 0,
          "default": 250000
        }
      }
    },
    "preconditions": {
      "type": "object",
      "additionalProperties": false,
      "required": [
        "files"
      ],
      "properties": {
        "files": {
          "type": "array",
          "items": {
            "type": "object",
            "additionalProperties": false,
            "required": [
              "path",
              "sha256"
            ],
            "properties": {
              "path": {
                "type": "string"
              },
              "sha256": {
                "type": "string",
                "pattern": "^[0-9a-f]{64}$"
              }
            }
          },
          "default": []
        },
        "head_sha": {
          "type": "string"
        },
        "dirty": {
          "type": "boolean"
        }
      }
    },
    "ops": {
      "type": "array",
      "items": {
        "$ref": "#/$defs/op"
      },
      "default": []
    },
    "summary": {
      "type": "object",
      "additionalProperties": false,
      "required": [
        "ops_total",
        "ops_blocked",
        "files_touched"
      ],
      "properties": {
        "ops_total": {
          "type": "integer",
          "minimum": 0
        },
        "ops_blocked": {
          "type": "integer",
          "minimum": 0
        },
        "files_touched": {
          "type": "integer",
          "minimum": 0
        },
        "patch_bytes": {
          "type": "integer",
          "minimum": 0
        },
        "safety_counts": {
          "type": "object",
          "additionalProperties": false,
          "required": ["safe", "guarded", "unsafe"],
          "properties": {
            "safe": {
              "type": "integer",
              "minimum": 0
            },
            "guarded": {
              "type": "integer",
              "minimum": 0
            },
            "unsafe": {
              "type": "integer",
              "minimum": 0
            }
          }
        }
      }
    }
  },
  "$defs": {
    "finding_ref": {
      "type": "object",
      "additionalProperties": false,
      "required": [
        "source",
        "code"
      ],
      "properties": {
        "source": {
          "type": "string"
        },
        "check_id": {
          "type": "string"
        },
        "code": {
          "type": "string"
        },
        "path": {
          "type": "string"
        },
        "line": {
          "type": "integer",
          "minimum": 1
        },
        "fingerprint": {
          "type": "string"
        }
      }
    },
    "op": {
      "type": "object",
      "additionalProperties": false,
      "required": [
        "id",
        "safety",
        "blocked",
        "target",
        "kind",
        "rationale"
      ],
      "properties": {
        "id": {
          "type": "string"
        },
        "safety": {
          "type": "string",
          "enum": [
            "safe",
            "guarded",
            "unsafe"
          ]
        },
        "blocked": {
          "type": "boolean"
        },
        "blocked_reason": {
          "type": "string"
        },
        "target": {
          "type": "object",
          "additionalProperties": false,
          "required": [
            "path"
          ],
          "properties": {
            "path": {
              "type": "string"
            }
          }
        },
        "kind": {
          "$ref": "#/$defs/op_kind"
        },
        "rationale": {
          "type": "object",
          "additionalProperties": false,
          "required": [
            "fix_key",
            "findings"
          ],
          "properties": {
            "fix_key": {
              "type": "string"
            },
            "description": {
              "type": "string"
            },
            "findings": {
              "type": "array",
              "items": {
                "$ref": "#/$defs/finding_ref"
              },
              "default": []
            }
          }
        },
        "params_required": {
          "type": "array",
          "items": {
            "type": "string"
          },
          "default": []
        },
        "preview": {
          "type": "object",
          "additionalProperties": false,
          "properties": {
            "patch_fragment": {
              "type": "string"
            }
          }
        }
      }
    },
    "op_kind": {
      "type": "object",
      "additionalProperties": false,
      "required": [
        "type"
      ],
      "properties": {
        "type": {
          "type": "string",
          "enum": [
            "toml_set",
            "toml_remove",
            "toml_transform"
          ]
        },
        "toml_path": {
          "type": "array",
          "items": {
            "type": "string"
          }
        },
        "value": {},
        "rule_id": {
          "type": "string"
        },
        "args": {}
      },
      "allOf": [
        {
          "if": {
            "properties": {
              "type": {
                "const": "toml_set"
              }
            }
          },
          "then": {
            "required": [
              "toml_path",
              "value"
            ]
          }
        },
        {
          "if": {
            "properties": {
              "type": {
                "const": "toml_remove"
              }
            }
          },
          "then": {
            "required": [
              "toml_path"
            ]
          }
        },
        {
          "if": {
            "properties": {
              "type": {
                "const": "toml_transform"
              }
            }
          },
          "then": {
            "required": [
              "rule_id"
            ]
          }
        }
      ]
    }
  }
}