{
  "inputs": [
    {
      "path": "<ARTIFACTS>/builddiag/report.json",
      "schema": "builddiag.report.v1",
      "tool": "builddiag"
    }
  ],
  "ops": [
    {
      "blocked": false,
      "id": "ab9ced5a-84ab-52fb-9080-73eece088fd5",
      "kind": {
        "rule_id": "ensure_workspace_resolver_v2",
        "type": "toml_transform"
      },
      "rationale": {
        "description": "Sets [workspace].resolver = \"2\" for correct feature unification",
        "findings": [
          {
            "check_id": "workspace.resolver_v2",
            "code": "not_v2",
            "line": 1,
            "path": "Cargo.toml",
            "source": "builddiag"
          }
        ],
        "fix_key": "builddiag/workspace.resolver_v2/not_v2"
      },
      "safety": "safe",
      "target": {
        "path": "Cargo.toml"
      }
    }
  ],
  "policy": {
    "allow": [],
    "allow_dirty": false,
    "allow_guarded": false,
    "allow_unsafe": false,
    "deny": []
  },
  "preconditions": {
    "files": [
      {
        "path": "Cargo.toml",
        "sha256": "<SHA256>"
      }
    ]
  },
  "repo": {
    "root": "<REPO_ROOT>"
  },
  "schema": "buildfix.plan.v1",
  "summary": {
    "files_touched": 1,
    "ops_blocked": 0,
    "ops_total": 1,
    "safety_counts": {
      "guarded": 0,
      "safe": 1,
      "unsafe": 0
    }
  },
  "tool": {
    "name": "buildfix",
    "version": "test"
  }
}